{
  "project_code": "WX-YGJ",
  "generated_at": "2026-08-06T18:23:48",
  "work_item_count": 1,
  "ready_work_item_count": 1,
  "incomplete_work_item_count": 0,
  "testcase_count": 75,
  "open_risk_count": 0,
  "stale_quality_report_count": 0,
  "priority_counts": {
    "P0": 25,
    "P1": 47,
    "P2": 3
  }
}
